forum_topic_id,forum_topic_url,forum_topic_name,forum_topic_author,forum_topic_time,forum_locate_id,forum_topic_text
k524968,https://www.tripadvisor.com/ShowTopic-g186338-i17-k524968-Trip_Reports_Collection_Please_post_here-London_England.html,[u'\nTrip Reports Collection - Please post here\n'],[u'offtolondon'],"[u'Mar 22, 2006, 10:12 AM']",g186338,"[u""For everyone's convenience and reading pleasure, please post links to all your trip reports (past, present, and future) here on this thread. If you also have pictures posted somewhere on the Net, include those links as well."", u'Without further adieu, on with the show!']"
k9432736,https://www.tripadvisor.com/ShowTopic-g186338-i17-k9432736-Oyster_card_for_15_year_old_son-London_England.html,[u'\noyster card for 15 year old son.\n'],[u'migro11'],"[u'Apr 13, 2016, 4:59 AM']",g186338,"[u'Hi ,', u'coming with my son to London this weekend.', u""i'd like to know if he can travel in the city with a discounted card for kids."", u'and please , if the anwser is positive , how to buy it ? do he needs a photograph?', u'we are comimg only for 4 days.', u'i will have an regular oyster for me.', u'thanks a lot!']"
k9428158,https://www.tripadvisor.com/ShowTopic-g186338-i17-k9428158-Travelling_around_london-London_England.html,[u'\ntravelling around london\n'],[u'lindyl0u41'],"[u'Apr 11, 2016, 2:20 PM']",g186338,"[u'hi there, will be making a trip to london 3rd to 5th june, staying in travelodge southwark, can anyone tell me how i would go about joining the big bus tour from here, where is the nearest stop i can get on? Does the red tour bus stop at baker street? where do you get the maps for the tours? and if anyone has any info at all they would like to offer me i would be grateful, getting very anxious trying to book this trip, will be travelling with 2 teenage daughters. thanks']"
k9432578,https://www.tripadvisor.com/ShowTopic-g186338-i17-k9432578-London_in_August-London_England.html,[u'\nLondon in August\n'],[u'traveldiaries22'],"[u'Apr 13, 2016, 3:28 AM']",g186338,"[u'Hi Folks,', u'Planning a short trip to London this August.', u""We're looking at 5 days - would that be enough? "", u'Also looking at a day to visit Old Trafford so would appreciate if you guys can help me understand the best way to get to ', u' from London.', u'Thank you in advance.']"
k9432787,https://www.tripadvisor.com/ShowTopic-g186338-i17-k9432787-Sunday_Free_Car_Parking_near_to_Hyde_Park-London_England.html,[u'\nSunday Free Car Parking near to Hyde Park ?\n'],[u'jerryxu2015'],"[u'Apr 13, 2016, 5:25 AM']",g186338,"[u'Hi,', u'Is there any free parking space near hyde park or albert hall for Sunday? My daughter and I are going to a concert in Albert hall this Sunday, and any free or cheap parking spaces will be a great help.', u'Many Thanks']"
k9432940,https://www.tripadvisor.com/ShowTopic-g186338-i17-k9432940-Alone_in_London_in_May-London_England.html,[u'\nAlone in London in May?\n'],[u'oslogirl285'],"[u'Apr 13, 2016, 6:43 AM']",g186338,"[u'I am traveling to London on a long weekend May 12 to 15, by myself, anyone else in the same situation? Was thinking it might be nice to meet up one night for dinner, drinks, etc.?', u'I am a female from ', u', 35 years old, who thinks its always nice to meet new people from other countries :)', u'Also: any advice for fun things to do alone in the evenings? Its easy to fill the daytime, but at nighttime I need advice :)']"
k9426995,https://www.tripadvisor.com/ShowTopic-g186338-i17-k9426995-30th_Birthday_Meal_Central_London-London_England.html,[u'\n30th Birthday Meal Central London\n'],[u'Gem1207'],"[u'Apr 11, 2016, 7:33 AM']",g186338,"[u'Hello', u'I am organising a surprise birthday meal for my friend and there will be about 10 of us. I want to take her somewhere with good food and most importantly, a really fun atmosphere (it will be a Wednesday!).', u""I did think about Circus so somewhere a bit like that but I don't really want people spending more than about \xa316 for a main."", u'Was thinking maybe Steam and Rye??', u""Does anyone have any ideas? Don't mind cuisine, just has to be central soho type area and fun! Would be great if I could find somewhere that let me bring balloons etc."", u'Thanks!']"
k9432374,https://www.tripadvisor.com/ShowTopic-g186338-i17-k9432374-5_hours_at_Heathrow_is_there_a_Poundland_near_enough-London_England.html,"[u'\n5 hours at Heathrow, is there a Poundland near enough?\n']",[u'Jackie G'],"[u'Apr 13, 2016, 12:36 AM']",g186338,"[u""I will have a 5 hour layover in early August. I'm disappointed to learn that is not enough time for any sight seeing, but could I have enough time to go to A discount store like pound land or a supermarket? Just to get out of the airport and say I've shopped? Lol""]"
k9431054,https://www.tripadvisor.com/ShowTopic-g186338-i17-k9431054-Embankment_to_Tower_Hill-London_England.html,[u'\nEmbankment to Tower Hill\n'],[u'Pat D'],"[u'Apr 12, 2016, 1:33 PM']",g186338,[u'is it circle or district line (north) or which direction from Embankment to Tower Hill. Thanks']
k9398745,https://www.tripadvisor.com/ShowTopic-g186338-i17-k9398745-TALF_pub_meet_Wednesday_April_13th_The_Details-London_England.html,[u'\nTALF pub meet Wednesday April 13th - The Details\n'],[u'adamhornets'],"[u'Apr 01, 2016, 10:02 AM']",g186338,"[u'A new month and a new pub for our next TALF meet. It was suggested to me by a couple of people and I think the location will be handy for a lot of folk.', u'Here are the details:', u'The Knights Templar, 95 Chancery Lane, London WC2A 1DT from 7.00pm', u""It's a Wetherspoon pub so expect a large pub with a good beer choice and reasonable food. Look for the TALF sign. Nearest tube stations will be Chancery Lane (Central line) and Temple (Circle & District line)."", u'For those who enjoy trivia the pub is across the street from the office where my late father worked for over 30 years.', u'I know Foslo and Alison78 should be joining us and if you too would also like to come along to enjoy a drink and some good company with like minded travellers then you will be made most welcome. It would help if you could post below if you are planning on joining us so we can try to grab a suitably large table.']"
k9432990,https://www.tripadvisor.com/ShowTopic-g186338-i17-k9432990-Cycling_trail_near_london-London_England.html,[u'\nCycling trail near london\n'],[u'lzkl'],"[u'Apr 13, 2016, 6:58 AM']",g186338,"[u'Hi all, ', u'i heading to london in june and intend have one day to cycle leisurely in the countryside or surburbs near london. Will wish to experience the english countryside ,moors, farmlands and maybe hi tea in a english manor.', u'Is there any recommendation for such one day excursions with bike renting facilities? Not a professional biker so prefer some route with a flat terrain.', u'Thanks in advance!']"
k9432039,https://www.tripadvisor.com/ShowTopic-g186338-i17-k9432039-Travel_from_London_Paddington_to_Bath-London_England.html,[u'\nTravel from London Paddington to Bath\n'],[u'Nicki F'],"[u'Apr 12, 2016, 8:42 PM']",g186338,"[u'Am planning on landing at 8:15pm at Heathrow then taking the ', u"" into Paddington. I then want to travel from Paddington to Bath. I don't want to buy an advance ticket, because my plane could be delayed, etc. But the anytime tickets are extremely expensive. If I just waited until I arrived at Paddington station to buy a ticket to Bath, would I be able to purchase tickets (say 20 minutes before the train would leave)? Or is it safer to buy an anytime ticket in advance? Thank you!""]"
k9429489,https://www.tripadvisor.com/ShowTopic-g186338-i17-k9429489-Quick_Global_Blue_Premier_question-London_England.html,[u'\nQuick Global Blue/Premier question\n'],[u'FruGlo'],"[u'Apr 12, 2016, 1:20 AM']",g186338,[u'Hi I will be departing from Heathrow. I have two questions. 1- Am I supposed to include my receipt with the tax free form? 2- Does either Global or Premier have dedicated mailboxes at the airport? (a location that only their envelopes can be deposited). Thanks']
k9431477,https://www.tripadvisor.com/ShowTopic-g186338-i17-k9431477-Driving_experience_in_London_or_other_places-London_England.html,[u'\nDriving experience in London or other places\n'],[u'Michele D'],"[u'Apr 12, 2016, 4:09 PM']",g186338,"[u'I would really like to surprise my husband and college kids with this experience. ', u""In case the link doesn't work, it is where you get to pick from 4-5 nice vehicles and drive around a track and then drive with a professional. I tried to book through Virgin Experiences. It didn't work, so I contacted a company and asked availability and have heard nothing. "", u'This is going to be expensive so I really want to make sure it is a legitimate company I am contacting. It appears there are many locations to choose from. We will be in London from May 21-26 so would have all day from the 22-25th to make this happen. I am waiting to make any other plans in London to see if this will work out.', u'We will also be in the ', u' area earlier, so could do a different track. ', u""Has anyone here done this driving experience? If so, could you help me find the best way to contact a place to see if they have availability? I will call instead of email. I am just not sure if, for instance, the above link is directly to the business that offers the service or if it just sells the tickets and I purchase them and then find they are full and we can't get in during the dates we will be there. "", u'Thanks so much for any help. Also, what location would be best if we are staying in London?', u'Blessings,', u'Michele']"
k9433074,https://www.tripadvisor.com/ShowTopic-g186338-i17-k9433074-Transfer_from_Heathrow_to_Gatwick_early_morning-London_England.html,[u'\nTransfer from Heathrow to Gatwick early morning\n'],[u'Loneraider65'],"[u'Apr 13, 2016, 7:32 AM']",g186338,"[u'Hi, ', u'Can anyone recommend a private hire company that will do the Heathrow to Gatwick run at 6 am? Thanks', u'Ann']"
k9432085,https://www.tripadvisor.com/ShowTopic-g186338-i17-k9432085-Train_questions-London_England.html,[u'\nTrain questions\n'],[u'MrsT12_Aus'],"[u'Apr 12, 2016, 9:07 PM']",g186338,"[u'1) Is there such a thing as a timetable for the tube? Or does it just run services constantly that you never really have to wait?', u""2) Leaving from Holborn, I'd like to get to LHR by around 8.30am on a Thursday - will the Piccadilly line be packed at that hour of the day? (its not to catch a flight so timing doesnt need to be exact, but I'm curious if we will have room for our luggage/seats or if everyone gets packed in like sardines)"", u""3) Is there a timetable available for the train from Victoria station to Gatwick? Our flight departs from there at 14.30 on a Wednesday so I'm trying to work out how early we will have to be at the station in order to be at Gatwick north terminal by noon-ish."", u'Thanks!!']"
k8364867,https://www.tripadvisor.com/ShowTopic-g186338-i17-k8364867-FAQ_London_forum_frequently_asked_questions_UPDATED-London_England.html,[u'\nFAQ: London forum frequently asked questions - UPDATED!!!\n'],[u'theartgirl'],"[u'Apr 07, 2015, 10:05 AM']",g186338,"[u'LONDON FORUM FREQUENTLY ASKED QUESTIONS:', u'The best way to find relevant information on the London forum (often referred to as \u2018TALF\u2019 - Trip Advisor London Forum) is to use the \u201cSEARCH BOX\u201d at the top of the forum\u2019s table of contents, and type in the topic or key words that you are looking for. ', u'GENERAL FAQs', u'WEATHER: What is it like in (insert month here)?', u'The only consistent thing about British weather is its unpredictability. However, you can check 5-day forecasts, or the weather patterns over the past years, at these websites:', u'WHAT SHOULD I WEAR? ', u'Clothes that you can layer and comfortable shoes. No, it doesn\u2019t matter if you wear white sneakers. No one will care. The main thing to remember is that the weather is unpredictable, and that you are apt to be doing a lot of walking, so be comfortable. Use common sense \u2013 if you know that you are going out for a meal in a fine restaurant, for example, or think that a slightly dressier occasion will arise, include something suitable in your suitcase. ', u'WHAT TIME DOES THE SUN SET?', u'TIPPING: ', u'* Restaurants: Londoners tip about 10%, but some restaurants will add 12.5% or, in some high-end restaurants, 15% to the bill. Check your bill to see if a service charge of 10%, 12.5%, or 15% has already been added before adding a tip. Outside of London, 10% is still the norm, though some restaurants will include a 12.5% service charge.', u'* Pubs: It is not necessary to tip in pubs. However, if the same bar person serves you several times during the evening, you could offer ""one for yourself."" He or she will either have a soft drink or put the money in a pot to be distributed at the end of the evening.', u'* Taxis: Some people round up the fare to the nearest GBP; some tip 10%. ', u'* Housekeeping: Those who tip advise \xa31 per day in hotels. ', u'BANKS, MONEY, & CREDIT CARDS:', u'SMOKING: ', u'Britain has smoke-free legislation. Enclosed public areas, including those in hotels and restaurants, are smoke free.', u'HOW CAN I SEE LONDON ON A TIGHT BUDGET?', u'* Free and inexpensive activities can be found here:', u'* An active forum discussion on money-saving tips:', u'WHAT\u2019S ON IN LONDON DURING MY VISIT?', u'Time Out magazine is the tourist\u2019s \u2013 and local\u2019s \u2013 bible.', u'WHAT IS OPEN ON CHRISTMAS? WHERE CAN I EAT? IS THERE PUBLIC TRANSPORTATION ON CHRISTMAS DAY?', u'* If possible, DO NOT ARRIVE ON CHRISTMAS DAY!!! THERE IS NO PUBLIC TRANSPORTATION, and only a limited number of ethnic and hotel restaurants are open.', u'This information may change, but in general:', u'* The Tube runs a Sunday service on the 24th with the last train around 00:30. ', u'* THERE IS NO TUBE SERVICE ON CHRISTMAS DAY. A reduced service runs on Boxing Day with some stations closed. ', u'* THERE IS NO BUS SERVICE ON CHRISTMAS DAY, and a Sunday service on Boxing Day. ', u'* Taxis will carry a surcharge (in 2014 it was \xa34) for journeys between 8.00pm on Dec 24 and 6.00am on Dec 27 AND between 8.00pm on Dec 31 and 6.00am on Jan 2. ', u'Good Christmas Day advice:', u'* What\u2019s on in London over the Christmas period?', u'WHAT DOES THIS WORD/PHRASE MEAN? HOW DO I PRONOUNCE IT?', u'ANY SPECIAL ADVICE FOR SOLO WOMEN TRAVELLERS?', u'Yes. Here is an old thread with information that is still valuable:', u'TRANSPORTATION & LOCATION QUESTIONS', u'HOW DO I GET FROM THE AIRPORT TO LONDON?', u'* From Heathrow: ', u', Heathrow Connect, or the Piccadilly Line on the Tube.', u'* From Gatwick: Gatwick Express is best on a weekday before 10am, as it has dedicated luggage space and plenty of seats. After 10am on a weekday, or on weekends, it is cheaper to take Southern Rail (to Victoria Station) or Thameslink (to ', u' or St. Pancras) trains.', u'* From Stansted: Stansted Express, National Express coach, Terravision Victoria Bus, or easyBus to ', u'.', u'* From Luton: Thameslink Train, Green Line bus 757/easyBus. ', u'* From London City: Their website says, \u201cThe easiest way to get to/from London City Airport is to use London City Airport DLR station. The service\u2026has direct connections with the Jubilee Line (at Canning Town), Northern, Central, Circle and ', u' and City Line (all from Bank station).\u201d', u'WHERE IS THIS HOTEL, RESTAURANT, THEATRE, SHOP? ', u'HOW DO I GET THERE?', u'Type in the street address or postcode for detailed maps:', u' ', u'* How do I walk from here to there?', u'Type in your starting and ending locations for directions:', u'* How do I get from here to there by Tube or bus?', u'Use this journey planner:', u'* Anything I should know about the Underground and travelling with kids?', u'WHAT IS AN OYSTERCARD? WHAT IS A TRAVELCARD? WHICH ONE SHOULD I BUY?', u'HOW DO I TAKE ADVANTAGE OF 2-4-1 OFFERS? WHERE DO I BUY THE APPROPRIATE RAIL TICKETS?', u'HOW DO I PLAN RAIL JOURNEYS AND FIND OUT TICKET PRICES?', u'ACCOMMODATION QUESTIONS', u'IS THIS A GOOD HOTEL?', u'By all means, ask us on the London forum, but before you do\u2026', u'CAN YOU RECOMMEND AN INEXPENSIVE, CENTRALLY LOCATED LONDON HOTEL?', u'These tips will help you get value for money and advise you what to expect for your money.', u""* Hotel bedrooms in London are small compared to those in North America. Most hotel rooms are twins (two single beds) or a single Queen/King Size bed with little space around them. Your room is likely to be 'compact' and not what you would accept 'back home.'"", u'* You pay a hefty premium for a room right in the city centre. London has a great public transport system. You will save yourself a sizeable sum by selecting a hotel 3 or 4 Underground stops from the very centre of town. Consider districts like Bloomsbury, ', u' and Paddington/Lancaster Gate.', u""* These days, even a 'budget' hotel for an en-suite double/twin room is over \xa3100 per night. If you find a hotel offering anything below this rate, research it well. Caveat emptor!"", u'If you are watching your budget, try the following:', u""* The Travelodge UK chain. Go to their website and select the 'Savers' option. "", u""* Check out 'no frills' chains offering clean, well-maintained accommodation such as Premier Inn, easyHotel and Ibis. "", u'* Research Bed & Breakfast accommodation well. Note that many will be in 6-storey Victorian buildings & often won\u2019t have a lift.', u'* Rates vary according to district, time of week, and month. In general:', u'* Anything south of the river or in the City of London is much cheaper at the weekend.', u'* Some 4-star hotels have their best rates in August and at Christmas, when the business/conference trade goes quiet. ', u'A good list of budget hotels by neighbourhood can be found here:', u'IS THIS A GOOD NEIGHBOURHOOD? WHAT AMENITIES ARE IN THE AREA?', u'CAN I GET A HOTEL/THEATRE PACKAGE? ', u'WHAT ARE SOME REPUTABLE COMPANIES FOR SHORT-STAY APARTMENT RENTALS?', u'*Search the name of the rental company on the London forum if you are unsure. There have been several threads about disreputable companies and agents.', u'WHAT DO I NEED TO KNOW BEFORE BOOKING A SHORT-STAY APARTMENT RENTAL?', u'WHAT ABOUT HOSTELS OR AIRBNB? ', u'ARE THERE ALTERNATIVES TO HOTELS OR B&Bs?', u'The Bed & Breakfast Club offers accommodation in private London homes (and elsewhere in the UK).', u'********************************************************************', u'DINING AND DRINKING QUESTIONS', u'HOW DO I FIND A GOOD RESTAURANT?', u'For user reviews and to find restaurants by cuisine or location:', u'WHAT ARE LONDON\u2019S BEST RESTAURANTS?', u'RESTAURANTS WITH VIEWS?', u'BEST FISH & CHIPS?', u'BEST INDIAN RESTAURANT?', u'WHERE IS THE BEST AFTERNOON TEA?', u'Popular afternoon teas include Claridges, ', u', and ', u', but cream teas and afternoon teas in various price ranges are available throughout the city. Please note that, 99.9% of the time, you are probably looking for afternoon tea, NOT high tea. Here is an explanation of the difference between the two:', u'Afternoon teas:', u'* ', u' shows monthly special offers by various hotels and restaurants. ', u'Search the forum under \u201cafternoon tea\u201d for advice, and \u201ctea review\u201d or \u201cTALF tea\u201d for reviews of past TALF tea meets. ', u'HOW DO I GET TO BOROUGH MARKET?', u'IS THIS A GOOD PUB?', u'WHICH BARS HAVE THE BEST VIEWS?', u'ANY HAUNTED OR HISTORIC PUBS?', u'ARE CHILDREN ALLOWED IN PUBS?', u'According to the British Beer & Pub Associations website, ', u'""The licensee has overall discretion over whom he or she allows into the pub.', u'\u2026Generally speaking, children are allowed to enter a pub unless it has a particular licence condition that says children are not to be permitted.', u'The exception to this is if the pub is used \u201cprimarily or exclusively\u201d for the supply and consumption of alcohol on the premises. In this case a child under the age of 16 is not permitted on the premises\u2026unless they are accompanied by someone 18 or over.""', u'The Wetherspoon pub chain is child-friendly. ', u'IS THERE TABLE SERVICE IN PUBS? WHAT DOES IT MEAN TO \u2018BUY A ROUND?\u2019', u'Food and drink is ordered at the bar. Staff do not bring drinks to your table, but will bring your meal to the table.', u'********************************************************************', u'SHOPPING & ANTIQUES QUESTIONS', u'WHEN ARE THE LONDON MARKETS ON? HOW DO I GET TO PORTOBELLO MARKET?', u'WHERE IS THE BURBERRY OUTLET?', u'********************************************************************', u'CULTURE, ATTRACTIONS, & SPORTS QUESTIONS', u'WHAT ARE THE \u2018MUST SEES?\u2019', u'* An old thread, but the answers are still valid: ', u'A few popular choices:', u'* Tower of London ', u'* ', u'* St Paul\u2019s Cathedral', u'* Windsor Castle', u'* ', u'* ', u' cruises:', u'* ', u'HOW CAN I GET 2-FOR-1 ENTRY TO ATTRACTIONS?', u'* Note that these offers may change at short notice. ', u'See the Transportation section above for more 2-4-1 information.', u'HOW DO I VISIT THE HOUSES OF PARLIAMENT?', u':', u'PARKS & GARDENS:', u'HALF-PRICE THEATRE TICKETS: ', u'At the Half-Price Ticket Booth in ', u':', u'WHAT DAY TRIPS DO YOU RECOMMEND FROM LONDON?', u'WHAT ARE THE HOP-ON-HOP-OFF BUS TOUR ITINERARIES & PRICES?', u':', u'Do-it-yourself London walks:', u'HOW CAN I GET TICKETS TO A FOOTBALL MATCH?', u'The season runs from August until early May. NOTE THAT BUYING TICKETS FROM TOUTS (scalpers) IS ILLEGAL IN ENGLAND. ', u'For a list of fixtures go to ', u' ', u'GIVE ME IDEAS FOR SOMETHING OFF-THE-BEATEN PATH:', u'An old thread with suggestions that are still useful:', u'LONDON WITH KIDS:', u'MORE EXCELLENT INFO HERE FOR YOUR TRIP:', u'Still have questions? Search the London forum for your topic, and have a look at the TA Traveller Articles for London.', u'If you\u2019re still stuck, please ask your question on the London forum.']"
